Freshwater Fish|0|A community for those passionate about freshwater fish|1
Saltwater Fish|3|A community for those passionate about saltwater fish|2
Cichlid Enthusiasts|2|A community for those interested in cichlids|3
Betta Fish|7|A community for those who love betta fish|4
Tropical Fish|6|A community for those who are passionate about tropical fish|5
Marine Biology|5|A community for sharing knowledge about marine biology|6
Aquascaping|4|A community for those who enjoy creating beautiful underwater landscapes|7
Fishkeeping Tips|1|A community for sharing tips and advice on fishkeeping|8